
Pencil Mini Skirt - Berrylush",,http://www.berrylush.com/cdn/shop/files/1_c53074c9-572e-4c92-b9a1-7bb0fdfeac72.jpg?v=1750065781,,
Women's Mid Rise Light Blue Line Denim Skirt – Levis India Store,,http://levi.in/cdn/shop/files/000G70000_01_Styleshot.jpg?v=1732777701,,
How to Wear a White Denim Skirt in the Fall - The Trendy Chick,,https://www.thetrendychickblog.com/wp-content/uploads/2019/08/white-skirt-1-1440x2149.jpg,,
Felt extremely cute In my crop top / mini skirt combo ☺️ : r/selfie,,https://preview.redd.it/felt-extremely-cute-in-my-crop-top-mini-skirt-combo-v0-h0ci1quhxmmb1.jpg?width=640&crop=smart&auto=webp&s=4b9957929e957ecbf50b2e1b9575c283593ac549,,
Lottie Moss shows off her taut midriff in a crop top and mini ...,,https://i.dailymail.co.uk/1s/2023/06/16/20/72228001-12204227-Pose_The_OnlyFans_model_looked_sensational_in_the_fitted_coordin-a-101_1686944847585.jpg,,
Lottie Moss shows off her taut midriff in a crop top and mini ...,,https://i.dailymail.co.uk/1s/2023/06/16/20/72227997-12204227-Model_material_Lottie_Moss_25_showed_off_her_taut_midriff_in_a_s-m-99_1686944812203.jpg,,
𝚂𝚌𝚑𝚘𝚘𝚕 𝙵𝚒𝚝 💕,,https://i.pinimg.com/736x/6e/25/01/6e2501cdc9e8502bba1e59c0f237ec57.jpg,,
Buy Fitted Leather Skirt Online In India - Etsy India,,https://i.etsystatic.com/6184646/r/il/7fb3a7/6531618147/il_fullxfull.6531618147_772z.jpg,,
60s BLACK LEATHER MINI A-LINE SKIRT WITH BUCKLE - 26.5-27 ...,,https://sartorialmatters.co.uk/cdn/shop/files/P3750675_300x300.jpg?v=1715425942,,
"SevenSuperGirls on X: ""Please Keep Following Us Seven Super Girls ...",,https://pbs.twimg.com/profile_images/765684067295789057/-3vOiCTh_400x400.jpg,,
Your Girlfriend Shrinks and Eats You Paige Erin Turner - TorveaFilms,,https://www.torveafilms.com/wp-content/uploads/2024/12/YourGirlfriendShrinksAndEatsYouPaigeErinTurner.gif,,
"Cowgirl wearing a tiered skirt, pink tights and light blue blouse ...",,https://creator.nightcafe.studio/jobs/VquuE5bB4QxVYCWTFFny/VquuE5bB4QxVYCWTFFny--1--3us81.jpg,,
"Pin by Samantha2 Houdini on skirts | Stylish outfits, Black ...",,https://i.pinimg.com/564x/8e/76/5d/8e765da0b5d1088a190e688adfdee4e2.jpg,,
Pin by Flien Varkensbrood on kleding in 2025 | Black leather ...,,https://i.pinimg.com/736x/b3/b9/ba/b3b9babb66acd2e81fbc4a2735b3bb2f.jpg,,
Brown Faux Leather Skirt Outfit 2025 | www.takertrailers.ee,,https://i.pinimg.com/originals/2e/bd/f0/2ebdf0b7e9dbb082f2f463a50910b50b.jpg,,
Business casual,,https://i.pinimg.com/474x/0f/eb/15/0feb15532fc19d0a27edcb6d4672616f.jpg,,
Interview outfit that helped me got the job :),,https://i.pinimg.com/736x/b6/26/32/b62632f5e3928bf01b28afd773498529.jpg,,
46 Fashionable Job Interview Outfits for Women That Makes a Best ...,,https://i.pinimg.com/236x/ca/19/e9/ca19e9c8bb8ebf9323eee3789fd9bfe1.jpg,,
"8 Med school ideas | interview outfit, medical school interview ...",,https://i.pinimg.com/originals/2f/7d/ea/2f7deae15d5d1197c4019d34f5e2873a.jpg,,
13 Med School Interview Outfit ideas | school interview outfit ...,,https://i.pinimg.com/236x/b4/9a/8b/b49a8b05cad00df1d986c5e4de75f47a.jpg,,
Nine-Thirty to Five,,https://blogger.googleusercontent.com/img/b/R29vZ2xl/AVvXsEhlhOFiWUd22dr1lT3jFaB5Sol2fPvt2qDx3NFFVe3TYlFNIRm2qBFr_UVDIhm3j3KV2oDnByNf4GQLE2Yw0ojlwLoIBaPn0O8wFKa8peimOsHvPWk7fkr-DWxiSFv6oECm4OipBrnUoWdj/s640/06.26.18.jpg,,
Nine-Thirty to Five,,https://blogger.googleusercontent.com/img/b/R29vZ2xl/AVvXsEgtmZiXPkTov5YsXDEToL8XPukJk7L3tYVhS4LPKcswBT_sEn4FsVKWCl8htDQ1HEcE6Hd0rSMsw3-SzwHNJoCnTuxAr8K2fEmEtu7tcwHRHT-P629QN5XMq3lCrP4Y4TqYUPLfa1-6D1da/s640/2017_11_15_13_42_07.jpg,,
Nine-Thirty to Five,,https://blogger.googleusercontent.com/img/b/R29vZ2xl/AVvXsEizw92QVSZJJK2t7LSfhOYHgXewwUw2rqAdfLa-yl8YujODyzc74ilZNDpFfA7a4xQxsWZBmuOvv9QYZwLDjQ4yjM54opWyif_cjm6K__POFsS3WjkFPJBVg7XM0T9pHIEB5AY6zK6MRdqr/s640/JAN+8+2018.jpg,,
Nine-Thirty to Five,,https://blogger.googleusercontent.com/img/b/R29vZ2xl/AVvXsEj_OoJ_lJZUFT2iYmUl1oCCElrLxYVWjraVdnl7lpIiT8DAOxbjWMnoxVE5nbCMgqR071dlWGFVufeGnmcaFDQbHEc8eTxx1AwZ148tohQ7-tT7tD_SwA-1NitFLC55R_6LD2UHtbBmrWAb/s640/2017_09_28_15_59_08.jpg,,
Pinterest,,https://i.pinimg.com/474x/6a/73/eb/6a73ebc0aa5c036fc8de91b23f52615c.jpg,,
Denim Pencil Skirt,,https://blogger.googleusercontent.com/img/b/R29vZ2xl/AVvXsEgr1GufExcPbzb5SyDcoby47IhIt_bHE-cnYv-AZpAlLD_ZhcjTrqQnM-3Lt5iB7FAsUoGmJ7Zcw4s65SN-2bUdQtKnTOz9xcfuIsbQcnJtkWJIXqGQ7Jlw-5ZTFeUbKJt_Gh0cjsLXKwQ/s1600/092214_blog02.jpg,,
Dressing for the Holidays - Classy Girls Wear Pearls,,https://i.pinimg.com/736x/c5/2d/88/c52d88c54b0e66848a30271604b4caa3.jpg,,
"47 Cute hoco dresses ! ideas in 2025 | hoco dresses, homecoming ...",,https://i.pinimg.com/1200x/03/9a/c2/039ac29cab7f2fbbd9c65164c2e41ef0.jpg,,
"52 Hoco inspo ideas | homecoming pictures, homecoming poses, dance ...",,https://i.pinimg.com/236x/54/b2/ae/54b2aec88474f5a7937def72d1136167.jpg,,
Pin on Tight dresses,,https://i.pinimg.com/564x/13/f1/83/13f183ec1e51f6753478311dc919eab7.jpg,,
Pin on Quick saves,,https://i.pinimg.com/564x/bc/00/c5/bc00c5808a202f3f0b222f1de228cb35.jpg,,
School Uniform Girls Box Pleat Skirt Top of The Knee Plaid #50 by ...,,https://hellonella.com/cdn/shop/files/Untitleddesign-2_2201e74e-d464-4983-bcd9-dc3784d892bc.png?v=1689831402,,
"School Uniform Girls Solid Color Box Pleat Skirt Top of the Knee by hello 
nella",,https://hellonella.com/cdn/shop/products/Untitleddesign-6_e55d7b0d-0f3a-4ae0-841f-f28c676bbf16.jpg?v=1681711331,,
Everyday Girls 2 Pack Classic Pleated Water-Repellent School ...,,https://media.very.co.uk/i/very/PK9FQ_SQ1_0000000004_BLACK_ASf?$pdp_300x400_x2$&fmt=jpg,,
Senior Stitch Down Pleat Skirt UK | Trutex School Uniform,,https://www.trutex.com/media/catalog/product/cache/386599d6bde607ee7ea7f2b0cab4ca52/g/p/gpb_1-V2.jpg,,
School Uniform Girls Solid Color Box Pleat Skirt Top of the Knee ...,,https://hellonella.com/cdn/shop/products/Untitleddesign-18_af133b61-989b-4695-9189-20e89377792e.jpg?v=1681712071,,
Sexy Student High School Girls Uniform Skirt Women Fancy Dress ...,,https://i.ebayimg.com/images/g/aWMAAOSwyMlcnUU0/s-l1200.jpg,,
Jessica Denim Skirt – Urban Threads Clothing Boutique,,https://cdn.shopify.com/s/files/1/0603/1487/8045/files/MauveTank5_dceeefe8-a0f6-49f6-87fc-f3b4b13808bb.jpg?v=1713456652,,
"Skirt Porn Pictures, Nude Photos - Newest - Nude XXX Pics",,https://cdn.nudexxx.pics/content/galleries/856/5fb3741a9090aac9a8479a6d1a9e5328-3.jpg,,
straight skirt denim S - Yamibuy.com,,https://cdn.yamibuy.net/item/c1582befd0e0bc0b0a2a8bd4cc974e73_750x750.webp,,
9 Denim Skirt Outfit Ideas - Ashleigh Becker,,https://ashleighbecker.com/wp-content/uploads/2020/05/IMG_9520.jpg,,
"Designer fashion, Seoul-fully created | W Concept",,https://cdn.wconcept.com/products/migration/i/imgpin.wconceptusa.com/1875e84c038/3804e/44/1QXuZsEqDEAgy8f7lE2EbUFdYeo.jpg,,
Button-Front Denim Skirt – Evolverie Clothing,,https://evolverieclothing.com/cdn/shop/files/Evolverie-298_1445x.jpg?v=1696544564,,
Button-Front Denim Skirt,,https://evolverieclothing.com/cdn/shop/files/Evolverie-69_1445x.jpg?v=1696544590,,
The Denim Miniskirt Is Forever In Style—23 Options to Shop Before ...,,http://assets.vogue.com/photos/60e5e157445087934c4681ae/master/pass/00_promo_4x3.jpg,,
Tops To Wear With A Black Denim Skirt 2025 | www.cortijoelpuerto.com,,https://i0.wp.com/fmag.com/wp-content/uploads/2018/04/black-and-grey-striped-vest-top-with-black-denim-mini-skirt.jpg,,
How To Style A Denim Skirt,,https://i.pinimg.com/736x/68/21/a0/6821a024d43dbfc792d8fc8cce440ef5.jpg,,
Jupe mini fleurie superposée à volants-Cupshe France,,https://media.cupshe.com/cdn-review.cupshe.com/cmc-admin/2023_02_03/17_24_0231/ae40a50f-5e72-4347-af7f-7c6b05fbd13e/CAA02B3A005AM/5.jpg?speedsize=mxw_320,,
Jupe mini fleurie superposée à volants-Cupshe France,,https://media.cupshe.com/cdn-review.cupshe.com/cmc-admin/2023_02_03/17_24_0217/d32c4cdc-12ad-487a-85fb-e38da2c8b7e7/CAA02B3A005AM/3.jpg?speedsize=mxw_320,,
Jupe Mini Fleurie Froncée MINKPINK | Urban Outfitters Canada,,https://images.urbndata.com/is/image/UrbanOutfitters/80659535_040_b?$xlarge$&fit=constrain&qlt=80&wid=640,,
Jupe Mini Fleurie Froncée MINKPINK | Urban Outfitters Canada,,https://images.urbndata.com/is/image/UrbanOutfitters/80659535_040_d?$xlarge$&fit=constrain&qlt=80&wid=640,,
Sister Jane Dream Wonderland Floral Sequin Mini Skirt,,https://images.urbndata.com/is/image/UrbanOutfitters/87177002_095_f?$xlarge$&fit=constrain&qlt=80&wid=640,,
Mini jupe évasée bleue – ANI ARPÉ,,https://aniarpe.com/cdn/shop/files/jupebleueface_1600x.jpg?v=1713345236,,
Mini jupe évasée bleue – ANI ARPÉ,,https://aniarpe.com/cdn/shop/files/veste-en-tweed_600x.png?v=1729328794,,
Kit à coudre Jupe femme St-Raphaël | La Droguerie,,https://www.ladroguerie.com/wp-content/uploads/2023/09/kit-couture-jupe-volants-femme-saint-raphael14.jpg.webp,,
Kit à coudre Jupe femme St-Raphaël | La Droguerie,,https://www.ladroguerie.com/wp-content/uploads/2023/09/kit-couture-jupe-volants-saint-raphael11.jpg.webp,,
jupe Discrète femme laine mérinos bio et soie - Le Mouton à Soie,,https://lemoutonasoie.fr/wp-content/uploads/2022/11/le-mouton-a-soie-laine-merinos-soie-top-antique-jupe-discrete-femme-2.jpg,,
MINI JUPE ÉVASÉE – ANI ARPÉ,,https://aniarpe.com/cdn/shop/files/2_800x.png?v=1713198804,,
Jupe Mini Eugenie For Love & Lemons,,https://images.urbndata.com/is/image/UrbanOutfitters/61359139_089_b?$xlarge$&fit=constrain&qlt=80&wid=640,,
Jupe Mini en Tweed Macaron Sister Jane | Urban Outfitters Canada,,https://images.urbndata.com/is/image/UrbanOutfitters/85814531_033_b?$xlarge$&fit=constrain&qlt=80&wid=640,,
Jupe short effilochée - Enfants | MANGO France métropolitaine,,https://shop.mango.com/assets/rcs/pics/static/T8/fotos/S/87025985_02.jpg?imwidth=2048&imdensity=1&ts=1740495940574,,
Jupe-short en jean élastique pour fille en couleur bleue. Parfaite ...,,https://resources.boboli.es/product/401128-BLUE-SS25/list/w/a_4/jupe-short-en-denim-elastique-pour-fille-de-couleur-bleue.jpg,,
"KIDPIK Girls Color Denim Skirt, Size: 2 - 16 - Walmart.com",,https://i5.walmartimages.com/asr/bbefa6f5-2980-448e-a040-28c9cb7fea0f.bee0acae1a237043baf86a58b1594597.jpeg?odnHeight=768&odnWidth=768&odnBg=FFFFFF,,
The Jean Skirt: Old is New Again — Magenta Blazer,,https://images.squarespace-cdn.com/content/v1/56f9da28044262353036fc61/1534035951668-DHWENM1SVZWUTQPFQNLL/IMG_1572.JPG?format=750w,,
The Jean Skirt: Old is New Again — Magenta Blazer,,https://images.squarespace-cdn.com/content/v1/56f9da28044262353036fc61/1534035958376-N4DZ0LBRULW4D3T031YJ/IMG_1588.jpg,,
AL🌺HA! Happy New Year from Hawaii🌴🍍,,https://lookaside.fbsbx.com/lookaside/crawler/threads/DEhgKUYJx6u/0/image.jpg,,
Photo posted by Krysiak Sisters (@krysiaksisters123),,https://lookaside.fbsbx.com/lookaside/crawler/threads/DFInamKJd1K/1/image.jpg,,
Krysiak Sisters | Still holding onto Summer 😎 #summervibes ...,,https://lookaside.instagram.com/seo/google_widget/crawler/?media_id=3188100516315542921,,
We had a blast @roncespolishfestival celebrating our heritage via ...,,https://lookaside.instagram.com/seo/google_widget/crawler/?media_id=3458005581392384586,,
Buy Lyush Girls Pink Acid Wash Denim Tiered Mini Skirt Online at ...,,https://www.distacart.com/cdn/shop/products/NVSKRT30271-1_1280x.jpg?v=1685617745,,
Buy Denim Tiered Mini Skirt with Pockets Pink For Kids | Styli Bahrain,,https://images.stylishop.com/media/catalog/product/2111145528/images/2111145528_5.jpg?v=1,,
Styli,,"https://images.stylishop.com/cdn-cgi/image/width=500,quality=100/media/catalog/product/2111145528/images/2111145528_2.jpg?v=1",,
"Grades 4, 6 and 8! 📚 Bittersweet ~ the last time the Krysiak ...",,https://lookaside.instagram.com/seo/google_widget/crawler/?media_id=3450003459472274380,,
"Grades 4, 6 and 8! 📚 Bittersweet ~ the last time the Krysiak ...",,https://lookaside.instagram.com/seo/google_widget/crawler/?media_id=3450003459698697988,,
"Pin by David Lothian on YUMMY | Mini skirts, Check skirt, Pleated ...",,https://i.pinimg.com/736x/31/32/35/313235283c2198b8659f872449c12c87.jpg,,
"6 image set, selfie in the ba | Tensor.Art",,"https://image.tensorartassets.com/cdn-cgi/image/anim=false,plain=false,w=320,q=85/posts/images/623828357745972795/daaf6beb-05d4-45dd-995e-346f08f9a46a.jpg",,
Nine-Thirty to Five,,https://blogger.googleusercontent.com/img/b/R29vZ2xl/AVvXsEgdCyNMBogiVouxV1NSKAAxzyCviF8YNXC_2DyBD7qaNR4D7HeEXkXU2EWww8lYUzC2aSBx5wlAs5zjUYQEGYmp5rI1BolN4SFL63Uu74CqYcpQUhYAPwaAvV3NHRPrLQmFp0gpQz6uuCrV/s640/2017_03_28_17_35_05.jpg,,
Women's Summer Bandage Leather High Waist Pencil Skirt - Pink / M,,https://i.pinimg.com/736x/72/67/26/72672627474c51522ef0eb1485132fdc.jpg,,
Walk On By Faux Leather Pencil Skirt - Burgundy – privityboutique,,https://privityboutique.com/cdn/shop/products/image_0da46da9-1779-40b2-b34e-68295679ca17.jpg?v=1636407338,,
Leather pencil skirt work appropriate top,,https://i.styleoholic.com/2018/08/02-a-black-leather-pencil-skirt-a-black-top-and-shoes-for-a-monochromatic-look.jpg,,
Grey Leather Panelled Pencil Skirt | We are calling the girls and ...,,https://lookaside.fbsbx.com/lookaside/crawler/media/?media_id=1036842753732937&get_thumbnail=1,,
Pin by Dutch Pretender on Leather skirt | Brown leather skirt ...,,https://i.pinimg.com/736x/65/c4/67/65c46770fc02c018ffa9a10f012cdbe9.jpg,,
Leather Mini Skirt – La Vida Bohemia,,https://lavidabohemia.com/cdn/shop/files/BLACK-LEATHER-MINI-SKIRT-SK8514_2_grande.jpg?v=1729877435,,
Skirts,,https://i.pinimg.com/474x/3e/f3/c5/3ef3c566b82f57529380dfc7041df147.jpg,,
Faux leather pencil skirt,,https://i.pinimg.com/236x/fc/e5/78/fce5788cc325ffcac30bdc2da1835911.jpg,,
"Pin by Rebecca on Leather skirts+ | Skirts, Leather pencil skirt ...",,https://i.pinimg.com/736x/cd/18/d6/cd18d6f71ce1f775f0d3613866a2b3ab.jpg,,
Ladies black faux leather pencil skirt top,,https://teaella.com/cdn/shop/products/Pics-407_9ebaeae7-db5a-4f76-a26a-90934ba0062d_800x.jpg,,
lace top and faux leather skirt holiday look,,https://i.pinimg.com/736x/3a/5b/1b/3a5b1b0631ce913d277e77e6d630dc72.jpg,,
Leather Pencil Skirt – Work Wear Wednesday - Loverly Grey,,https://loverlygrey.com/wp-content/uploads/2019/09/KVC_5110-684x1024.webp,,
Neoprene Skirt/Red Skirt/Fashion Skirt/Casual Skirt/Women Mini ...,,https://kinu.dk/wp-content/uploads/2020/12/il_fullxfull.1102875262_jc4z.jpg,,
Maeve Faux-Leather Side-Slit Micro Mini Skirt | Anthropologie ...,,https://i.localised.com/img/an/product/ef210f9f-6fb9-4112-81fa-64b6336522ee_THUMB.jpg,,
Selected Femme SLFNEW NOOS - Mini skirt - black - Zalando.co.uk,,https://img01.ztat.net/article/spp-media-p1/f9798b6186ae44b8a539baf8d6ce2457/1d560eb7201948e69b9754c71a163045.jpg?imwidth=762,,
SANDRO Short Leather Skirt in Black | endource,,https://cdn.endource.com/image/8bddc6138ed82b22edd71d49e157cd2d/detail/sandro-short-leather-skirt.jpg?optimizer=image&class=800,,
WAREHOUSE Faux Leather Knee Length Skirt | endource,,https://cdn.endource.com/image/a3f0657726c2d4cded6be6e6e8024509/detail/warehouse-faux-leather-knee-length-skirt.jpg?optimizer=image&class=800,,
Leather skater skirt. #skaterskirt #leatherskirt,,https://i.pinimg.com/736x/e0/43/b6/e043b6afd664d6c594a6a9db8da68e28.jpg,,
Maeve Faux-Leather Side-Slit Micro Mini Skirt | Anthropologie ...,,https://i.localised.com/img/an/product/e6596a5f-2ffc-4334-9ddd-f84f2b98995a_LARGE.jpg,,
Maeve Faux Leather A-Line Mini Skirt | Anthropologie Taiwan ...,,https://i.localised.com/img/an/product/3a1d4182-f8b8-444e-a4d3-584875c2a64c.jpg,,
Viv Faux Leather Mini Skirt in Vanilla - SABA,,"https://media.saba.com.au/image/upload/c_fill,f_auto,h_785,q_auto,w_628/v1740462799/media/image/ww25811_vanilla_01.jpg",,
LIMITED EDITION LEATHER LACE SKIRT - Brown | ZARA Canada,,https://static.zara.net/assets/public/3bda/bae1/5c8e4da68807/91a3b0b523c0/01758505700-p/01758505700-p.jpg?ts=1737972606475&w=744&f=auto,,
Women's Leather Skirts | ZARA Canada,,https://static.zara.net/assets/public/d060/0564/a8594644a7c1/c9da87a2790f/01758505700-a1/01758505700-a1.jpg?ts=1737972605149,,
LACE The Label Faux-Leather Laser-Cut Mini Skirt | Bethesda Row,,https://cdn.mall.adeptmind.ai/https%3A%2F%2Fimages.urbndata.com%2Fis%2Fimage%2FAnthropologie%2F4120953800007_001_b4%3Fqlt%3D100%26wid%3D1280_large.webp,,
LACE The Label Faux-Leather Laser-Cut Mini Skirt | Bethesda Row,,https://cdn.mall.adeptmind.ai/https%3A%2F%2Fimages.urbndata.com%2Fis%2Fimage%2FAnthropologie%2F4120953800007_001_b3%3Fqlt%3D100%26wid%3D1280_large.webp,,
NEW By Anthropologie The Colette Faux Leather Mini Skirt by Maeve ...,,https://u-mercari-images.mercdn.net/photos/m50874691539_1.jpg,,
Maeve Faux Leather A-Line Mini Skirt Brown - ShopStyle,,https://img.shopstyle-cdn.com/sim/43/36/43364e1e3abb611be32c261c6a2fd384_xlarge/maeve-faux-leather-a-line-mini-skirt-brown.jpg,,
Brown Leather A Line Skirt | WHISTLES | Whistles US |,,"https://res.cloudinary.com/tfg-whistles/image/upload/fl_keep_dar/b_rgb:FFFFFF,c_fill,dpr_2.0,f_auto,g_auto,h_700,q_auto,w_500/v1/wh-catalog/images/00903890516/whistles-leather-a-line-skirt-brown-01?pgw=1&_i=AG",,
"Womens Vintage Leather Skirts - Mini, Midi & Maxi - Blue 17 ...",,https://www.blue17.co.uk/wp-content/uploads/2015/03/leather-skirt-mini-e1427548405616-1200x1349.jpg,,
A few of the SevenSuperGirls got together recently in Pasadena ...,,https://lookaside.fbsbx.com/lookaside/crawler/media/?media_id=1502607736473616,,
The List Kids: Justice Print Work,,https://blogger.googleusercontent.com/img/b/R29vZ2xl/AVvXsEiSOAhyphenhyphenJSuF53XShCYzCmG9iBtTmgc5eQq-qKuv_NAq0iqUqecjbWj6VeszN1OfBNyQgqF7FMQKdM5jdsHgijqK9ja3LKfSaeBZFptQkDn6QdxNPjlEDs4f2f1m18rBTvcMohsoDUoCzSHh/s1600/normal_justice025.jpg,,
Malu Gallery 1176 - Crush Feet - 15 Photos,,https://www3.ffetish.photos/uploads/posts/2018-11/malu-gallery-1176-crush-feet-malu-001176-04-image-2.jpg,,
"100 Uniforms ideas | school uniform kids, school uniform fashion ...",,https://i.pinimg.com/236x/ba/af/0b/baaf0b75389a1d3c1164bf1fcc0fd555.jpg,,
Pin on Cute school uniforms,,https://i.pinimg.com/736x/d3/57/69/d357697e84dd9faad5031df9d9bcb407.jpg,,
"School uniform outfits ideas | school uniform outfits, cute school ...",,https://i.pinimg.com/236x/43/bd/27/43bd27c131fdc1a814830d31dc3880e9.jpg,,
uniform outfitsss,,https://i.pinimg.com/474x/80/27/15/802715c6fa1d1c322a7a227809f20477.jpg,,
"35 Uniform outfits 🤔💀 ideas | school uniform outfits, cute ...",,https://i.pinimg.com/736x/0e/20/16/0e20162fb5dc6c7d4756e29d6271027a.jpg,,
Uniform Orders – Families – Global Learning Charter Public School,,https://3.files.edl.io/1baf/23/10/06/181924-9147a550-faff-4210-b167-9b12d6d1e076.jpg,,
chool uniform$$ 🇱🇨,,https://i.pinimg.com/736x/66/bd/6f/66bd6f092fda744892483aca44017b41.jpg,,
"46 School Outfits ideas | school uniform outfits, school outfits ...",,https://i.pinimg.com/236x/ee/3c/09/ee3c09ff4a8c5b9a7491bc5bb785cf75.jpg,,
Pin on School uniform outfits,,https://i.pinimg.com/736x/df/ea/be/dfeabed1df36f3d107febd47c778452b.jpg,,
"Pin by 🖤 on Cute Fits,Cute Faces🎀 | School uniform outfits, Swag ...",,https://i.pinimg.com/736x/95/a9/13/95a913c971ef374354c4d08c1597f4fd.jpg,,
tewicyfayu,,https://i.pinimg.com/736x/6e/cd/ce/6ecdce719afbe4630690507ff3e20f46.jpg,,
Pin by Glorycreated 🕸️💖🏙️🦇🎀 on Junior year 23-24💖 | School ...,,https://i.pinimg.com/736x/c3/48/0b/c3480b907c2f7ead060ea114525f4919.jpg,,
School uniform outfits,,https://i.pinimg.com/170x/0a/44/80/0a4480109e4737ad4db9b0a10283e8be.jpg,,
"Pin by Pootymore on Schooling ya | Cute school uniforms, Swag ...",,https://i.pinimg.com/736x/29/b8/fd/29b8fd1543301e28c7a9cd9ade5895e3.jpg,,
"100 Uniforms ideas | school uniform kids, school uniform fashion ...",,https://i.pinimg.com/236x/8d/4a/36/8d4a368d04675852819982fee5d0040c.jpg,,
10 Trending Leggings Outfit Ideas Of 2019,,https://i.pinimg.com/736x/02/0d/85/020d85388c78294cc5e19908cf20c02a.jpg,,
Winter skirt outfit easy new arrivals,,https://i.pinimg.com/736x/7a/52/d1/7a52d17ba74bc05d9e39ce4390ea1a8a.jpg,,
GBM KPOP Idol Look Stretch Black School Uniform Skirt - School ...,,https://cdn-images.kooding.com/productDetailImage/568296-2/10076ac1757569b996ad248c3bdc82347a0aeeac.jpeg,,
GBM [KPOP Idol Look] Stretch Beige School Uniform Skirt Student Outfit,,https://cdn-images.kooding.com/productDetailImage/568304-2/90d33142f433188625fa33ced0a846ba0ed5911d.jpeg,,
Athleta Girl Goal Getter Skort | Athleta,,https://athleta.gap.com/webcontent/0055/268/076/cn55268076.jpg,,
Athleta Girl Pleated School Days Skort | Athleta,,https://athleta.gap.com/webcontent/0056/023/473/cn56023473.jpg,,
Athleta Girl School Day Skort | Athleta,,https://athleta.gap.com/webcontent/0056/023/562/cn56023562.jpg,,
Buy Cromoncent Women Pleated Skirt School Uniform Short Mini ...,,https://m.media-amazon.com/images/I/81QWUAmxS2L._SY550_.jpg,,
SANGTREE Girl Women Plus Size Pleated Uniform Casual Skater ...,,https://m.media-amazon.com/images/I/619j5VGSWLL._AC_UY1000_.jpg,,
Buy Cromoncent Women Pleated Skirt School Uniform Short Mini ...,,https://m.media-amazon.com/images/I/81VbFFfKDXL._SY606_.jpg,,
Buy Cromoncent Women Pleated Skirt School Uniform Short Mini Skirt ...,,https://m.media-amazon.com/images/I/71gzImxjrrL._AC_UY350_.jpg,,
All for Kids School Skirt Navy Blue | GIRL \ SKIRTS \ COTTON |,,https://e-lily.pl/hpeciai/15c7f75659014c5494152192c23e7d85/eng_pm_All-for-Kids-School-Skirt-Navy-Blue-3067_5.jpg,,
black school skirts size 16,,https://i.pinimg.com/736x/7f/5b/00/7f5b00f5570fce46165705e411ab9694.jpg,,
School Uniform Girls Solid Color Box Pleat Skirt Top of the Knee ...,,https://hellonella.com/cdn/shop/products/Untitleddesign-3_b0ffed99-3642-41f8-9519-1991641ac72a.jpg?v=1683358129,,
NWT French Toast Adjustable Waist Front Pleated Tab Skirt Size 18 Khaki New,,https://i.ebayimg.com/images/g/ZuMAAOSwISBlUER7/s-l1200.jpg,,
Girls in White Shirts and Green Plaid Skirts · Free Stock Photo,,https://images.pexels.com/photos/8147368/pexels-photo-8147368.jpeg?auto=compress&cs=tinysrgb&w=1260&h=750&dpr=1,,
Beige GIRLS & TEENS Girl Regular Fit Skirt 2897019 | DeFacto,,https://dfcdn.defacto.com.tr/2/A6002A8_23AU_BG693_01_02.jpg,,
How to wear hot pink top skirt,,https://mydressyways.files.wordpress.com/2012/04/04-4-12-loft-pink-skirt-striped-top-4.jpg,,
"Feeling Feminine... – Rachel Parcell, Inc.",,https://cdn.shopify.com/s/files/1/1226/7704/files/kate-spade-polka-dot-high-heels.jpg,,
Kate spade deals hot pink skirt,,https://i0.wp.com/cortneybre.com/wp-content/uploads/2014/02/20140228_125803.jpg,,
Amber Jayne waiting for her handsome lover down on her knees for ...,,https://hellmoms.com/contents/videos_screenshots/2000/2979/preview.jpg,,
5 Leather Skirt Outfit Ideas Look Book,,https://i0.wp.com/theaestheticedge.com/wp-content/uploads/2021/05/24-black-leather-skirt-outfit.jpg?resize=550%2C733&ssl=1,,
High Schools Efficient With Uniforms Near Me,,https://southlandscs.com/wp-content/uploads/2014/06/untitled-14-1.jpg,,
Dress Code - Northville Christian School,,https://northvillechristian.school/wp-content/uploads/2023/08/FullSizeRender-1024x1024.jpeg,,
brown-suede-skirt-6 - On/Off Duty,,http://www.onandoffduty.com/wp-content/uploads/2017/01/brown-suede-skirt-6.jpg,,
"Shopping Reviews, Vol. 76 J.Crew Sale | Something Good | A Style Blog",,https://www.somethinggoodblog.com/wp-content/uploads/2019/01/j.crew-factory-Faux-suede-mini-skirt_Something-Good-1024x1024.jpg,,
8 Spring Work Outfits | Petite Fashion | Pumps & Push Ups,,https://i.pinimg.com/736x/f6/ca/1a/f6ca1aebc0fa3196addbf83c3b6b02e4.jpg,,
8 Spring Work Outfits - Petite Fashion | Pumps & Push Ups,,https://pumpsandpushups.com/wp-content/uploads/2021/04/IMG_5858.jpg,,
"16 Office Outfits ideas | outfits, work outfit, work attire",,https://i.pinimg.com/736x/1f/ef/d7/1fefd7b6c9c0b5cc7017612866ab332d.jpg,,
Tween school fashion,,https://i.pinimg.com/236x/78/f7/46/78f746e31414c0a84826070251ad65ab.jpg,,
Natalie Grant - What am I holding in my hand? Book 3 of my ...,,https://lookaside.fbsbx.com/lookaside/crawler/media/?media_id=10154320526715421,,
Another new school year. 2 sophomores and a 6th grader. And yes ...,,https://lookaside.instagram.com/seo/google_widget/crawler/?media_id=2906204881204203550,,
Need this moment documented in my feed - the twins first day of ...,,https://lookaside.instagram.com/seo/google_widget/crawler/?media_id=2642464487737420716,,
"11th grade. Day 1. Oh time, you are a thief. 😭😭❤️❤️",,https://lookaside.instagram.com/seo/google_widget/crawler/?media_id=3166693942442694608,,
"11th grade. Day 1. Oh time, you are a thief. 😭😭❤️❤️",,https://lookaside.instagram.com/seo/google_widget/crawler/?media_id=3166693942434338531,,
John Adams Academy - Online,,https://i.pinimg.com/736x/ee/ce/61/eece6187f9884a03e0c1fa25e84843ce.jpg,,
Fashion Friday – Casual Work Clothes Ideas,,https://i.pinimg.com/564x/50/d6/88/50d688b41878b419844f814c2f37d5ae.jpg,,
02.09.2018,,https://i.pinimg.com/736x/2f/04/d0/2f04d06f45e819ab5213da8d32c7e513.jpg,,
01.08.2017,,https://i.pinimg.com/564x/e6/68/37/e6683783d30334bf840cc774e35c8057.jpg,,
"Teacher Clothes ideas | clothes, work outfit, teaching outfits",,https://i.pinimg.com/originals/2c/b3/be/2cb3be5ddf405decdb20d4a3884d6b1a.jpg,,
"Fall Outfit. White spotted blouse, black skirt, black tights, gray ...",,https://i.pinimg.com/736x/dd/b7/eb/ddb7eb64042431da8620688ba1e0ac77.jpg,,
Pink Pencil Skirt - 44 Professional and Sophisticated Office ...,,https://i.pinimg.com/564x/8c/a9/64/8ca964bb7c00e625633d4fa83dad942d.jpg,,
Pink pencil deals skirt outfit ideas,,http://www.onandoffduty.com/wp-content/uploads/2018/03/chambray-shirt-pink-pencil-3.jpg,,
What I Wore 49: The Everyday Pencil Skirt — Freckled Italian,,https://images.squarespace-cdn.com/content/v1/52fd86dfe4b0a44284e8af84/1434988993302-GP61M2WW2JYUB39PMOS5/image-asset.jpeg,,
Franish: I tried...,,https://farm9.staticflickr.com/8677/15322603973_338f77c2fe_b.jpg,,
Franish: sleepy,,https://farm4.staticflickr.com/3778/13570505684_e5ab3a62bf_o.jpg,,
Franish: the smallest changes,,http://farm6.staticflickr.com/5492/9447276206_1a52a0fbcf_b.jpg,,
