Title,Note,URL,Tags,Comment
,,,,
I can step on you : r/GiantessFeet,,https://preview.redd.it/i-can-step-on-you-v0-6ywnfa179jea1.jpg?width=640&crop=smart&auto=webp&s=e92e2d7612ca07c2085a10999948e9f4f942c74d,,
Giantess Skirt Porn Videos - FAPSTER,,https://fapster.xxx/contents/videos_screenshots/884000/884721/452x259/1.jpg,,
How many girls are wearing a dress or skirt today with no panties?,,http://cdn-webimages.wimages.net/0515563f2466cf274255da4fb520e5c780f0bb.jpg?v=3,,
I like when women wear skirts with no panties.,,http://cdn-webimages.wimages.net/0508e081b715aa509290e3557a81f6b0de9988-wm.jpg?v=3,,
I saw a girl today in downtown with a dress no bra and no panties,,http://cdn-webimages.wimages.net/051395236e34ee3319846af0a366c14f7cbc4-wm.jpg?v=3,,
What do you guys think about a girl who wear dress without panties? ;),,http://cdn-webimages.wimages.net/0512eff372c4b4421940fa1fbdc91e5be96147-wm.jpg?v=3,,
Do girls ever wear a skirt and no panties to work or school just ...,,http://cdn-webimages.wimages.net/05092cb8e2aac8626888cdd3ff4e463cc6b2f8-wm.jpg?v=3,,
Girls probably don't realize that when they sit legs spread with a ...,,http://cdn-webimages.wimages.net/0517193f7f6ee7490599a747125f9fcf5be171.jpg?v=3,,
"Wear a short skirt, no panties. Sit in the front row of class ...",,http://cdn-webimages.wimages.net/052dd26a91443a82bd49a7f9eb07cf8011433b-v5-wm.jpg?v=3,,
I'm wearing a dress to work today with no panties underneath!! ☺️😜,,http://cdn-webimages.wimages.net/05062bb5fff7e33648995eb3afe9eb1c060c10.jpg?v=3,,
Went to work with no panties under my skirt,,http://cdn-webimages.wimages.net/05122bd1839db9510713288522e101c620dc6b.jpg?v=3,,
My friend talked me into wearing a skirt today in public with no ...,,http://cdn-webimages.wimages.net/0515a89d9627fc105852a87717a76fea9afc6a-wm.jpg?v=3,,
Walking around Walmart right now with no panties on under my skirt ...,,http://cdn-webimages.wimages.net/050d1042fe423815045655698bbbe785625c4b-wm.jpg?v=3,,
Wearing a skirt with no underwear in public turns me on so much,,http://cdn-webimages.wimages.net/05191fc41c173e4091503bb226f4ce9ad780af-wm.jpg?v=3,,
Wore a short skirt and no underwear to my class this morning. My ...,,http://cdn-webimages.wimages.net/05182b115174c876461641a9cb1b093630ebd4-wm.jpg?v=3,,
This weather is perfect for wearing a mini skirt with no panties ...,,http://cdn-webimages.wimages.net/051571978848ed332205b335099ae785ce56f9-wm.jpg?v=3,,
I'm a naughty girl who is wearing a short skirt no underwear and ...,,http://cdn-webimages.wimages.net/05172aeca3e846783366238a3b22d35997e600-wm.jpg?v=3,,
I want to wear short skirts to live the thrill of someone looking ...,,http://cdn-webimages.wimages.net/0517b8fbf3bc6629286adb8e074dc3aa3504f.jpg?v=3,,
Love girls with short skirts and flashing their panties when ...,,http://cdn-webimages.wimages.net/05114b7a2ec2d4657556fa90f25533681abd8f.jpg?v=3,,
