Title,Note,URL,Tags,Comment
,,,,
6 Chic Flat Shoe Trends That I Can't Wait to Try | Who What Wear,,https://cdn.cliqueinc.com/posts/306329/best-flat-shoe-trends-306329-1679596033791-main.700x0c.jpg,,
"flat shoes to wear with skirts for Sale,Up To OFF 69%",,http://4.bp.blogspot.com/-VPOyL-QOq20/T5Hq_AVrS5I/AAAAAAAADqQ/XfltlhQ52gg/s1600/beautiful+romantic+girl+in+skirt+sweet+flats+ant+nylons+tights+pantyhose.jpg,,
"BALLET FLATS OBSESSION Ballet Flats, Ballerina Shoes Flats,, 43% OFF",,https://live.staticflickr.com/5809/20814584624_2f69160358_z.jpg,,
"ballet flats with leggings for Sale,Up To OFF 75%",,https://i.pinimg.com/originals/a5/49/8b/a5498b596f8689fc8c46441f646dac43.jpg,,
